{
  "$schema": "https://json-schema.org/draft/2020-12/schema",
  "$id": "https://github.com/dreamabout/kaikei-envelope/schemas/v2/order_shipped.payload.schema.json",
  "title": "order.shipped payload",
  "type": "object",
  "additionalProperties": false,
  "required": [
    "order_id",
    "customer",
    "items"
  ],
  "properties": {
    "order_id": {
      "type": "string",
      "minLength": 1
    },
    "customer": {
      "$ref": "#/$defs/customer"
    },
    "items": {
      "type": "array",
      "minItems": 1,
      "items": {
        "$ref": "#/$defs/item"
      }
    },
    "currency": {
      "$ref": "#/$defs/currency"
    },
    "fx_rate": {
      "$ref": "#/$defs/decimal"
    },
    "prepayment_event_id": {
      "type": "string",
      "pattern": "^[0-9A-HJKMNP-TV-Z]{26}$"
    },
    "invoice_number": {
      "type": "string",
      "minLength": 1
    },
    "ean_number": {
      "type": "string",
      "pattern": "^[0-9]{13}$"
    },
    "payments": {
      "type": "array",
      "items": {
        "$ref": "#/$defs/payment"
      },
      "description": "How the sale was paid, one entry per payment method. An array because an order can be split across methods (gift card plus card), which a single gateway field cannot express -- the same reason order.refunded uses refund_payments[]. Optional and additive: producers that omit it stay valid, and the receiver can still resolve the method from the cash-in leg (payment.prepaid / order.captured) by order_id."
    },
    "payment_terms": {
      "$ref": "#/$defs/payment_terms"
    }
  },
  "$defs": {
    "decimal": {
      "type": "string",
      "pattern": "^-?\\d+\\.\\d{2}$"
    },
    "currency": {
      "type": "string",
      "pattern": "^[A-Z]{3}$"
    },
    "customer": {
      "type": "object",
      "required": [
        "country_code",
        "is_b2b"
      ],
      "properties": {
        "country_code": {
          "type": "string",
          "pattern": "^[A-Z]{2}$"
        },
        "postal_code": {
          "type": "string",
          "pattern": "^[A-Za-z0-9][A-Za-z0-9 -]{0,11}$",
          "description": "DELIVERY postal code, from the same address as country_code. Determines the VAT territory: 78266 is Buesingen (outside the EU VAT area entirely), 6691 is Jungholz (19%, not Austria's 20%). A billing postal code paired with a delivery country is wrong in exactly the cases this exists to catch."
        },
        "is_b2b": {
          "type": "boolean"
        },
        "customer_id": {
          "type": "string",
          "minLength": 1
        },
        "name": {
          "type": "string"
        },
        "email": {
          "type": "string"
        },
        "vat_number": {
          "type": "string"
        },
        "ean_number": {
          "type": "string",
          "pattern": "^[0-9]{13}$"
        },
        "address": {
          "$ref": "#/$defs/address"
        }
      }
    },
    "address": {
      "type": "object",
      "properties": {
        "street": {
          "type": "string"
        },
        "city": {
          "type": "string"
        },
        "postal_code": {
          "type": "string"
        },
        "country": {
          "type": "string",
          "pattern": "^[A-Z]{2}$"
        }
      }
    },
    "item": {
      "type": "object",
      "required": [
        "type",
        "gross_amount",
        "vat_amount",
        "vat_rate"
      ],
      "properties": {
        "type": {
          "type": "string",
          "enum": [
            "physical",
            "gift_card",
            "digital",
            "shipping",
            "fee",
            "giftwrapping",
            "discount"
          ]
        },
        "gross_amount": {
          "type": "string",
          "pattern": "^-?\\d+\\.\\d{2}$"
        },
        "vat_amount": {
          "type": "string",
          "pattern": "^-?\\d+\\.\\d{2}$"
        },
        "vat_rate": {
          "type": "string",
          "pattern": "^-?\\d+\\.\\d{2,4}$"
        },
        "unit_cost": {
          "type": "string",
          "pattern": "^\\d+\\.\\d{2}$"
        }
      }
    },
    "payment": {
      "type": "object",
      "required": [
        "gateway",
        "amount"
      ],
      "additionalProperties": false,
      "properties": {
        "gateway": {
          "type": "string",
          "minLength": 1,
          "description": "Payment method the money came in on, as the accounting slug (same vocabulary as payment.prepaid / order.captured)."
        },
        "transaction_id": {
          "type": "string",
          "minLength": 1,
          "description": "Gateway-side reference, when there is one. OPTIONAL: gift cards and hand-entered payments legitimately have none, and requiring it would only produce placeholder values."
        },
        "amount": {
          "type": "string",
          "pattern": "^-?\\d+\\.\\d{2}$",
          "description": "Amount taken on this leg, in the document currency."
        }
      }
    },
    "payment_terms": {
      "type": "object",
      "required": [
        "days",
        "due_date"
      ],
      "additionalProperties": false,
      "description": "The sale is invoiced on credit (1.17.0). This, not customer.is_b2b, is the signal to issue the invoice with a payment term: is_b2b is also set on card-paid EU sales with a VAT exemption. Only on a B2B customer with a vat_number (enforced by the validator, tier 3).",
      "properties": {
        "days": {
          "type": "integer",
          "minimum": 0,
          "maximum": 120,
          "description": "The payment term in days, as agreed with the customer."
        },
        "due_date": {
          "type": "string",
          "format": "date",
          "pattern": "^\\d{4}-\\d{2}-\\d{2}$",
          "description": "The due date the producer set at shipping and shows the merchant. Sent rather than derived from days, so the two sides cannot disagree, for example when shipping and the event fall on either side of midnight."
        }
      }
    }
  }
}
