{
    "order_id": "O-110",
    "customer": {
        "country_code": "DK",
        "is_b2b": false
    },
    "items": [
        {
            "type": "physical",
            "gross_amount": "1250.00",
            "vat_amount": "250.00",
            "vat_rate": "0.25"
        }
    ],
    "currency": "DKK",
    "invoice_number": "INV-2026-0110",
    "payment_terms": {
        "days": 14,
        "due_date": "2026-10-23"
    }
}
